{
  "$schema": "https://raw.githubusercontent.com/chrystyan96/execfence/master/schema/execfence.schema.json",
  "policyPack": "baseline",
  "mode": "block",
  "blockSeverities": ["critical", "high"],
  "warnSeverities": ["medium", "low"],
  "roots": ["backend-go", "backend", "frontend", "desktop", "packages", "scripts", ".github", ".vscode"],
  "ignoreDirs": [],
  "skipFiles": [],
  "allowExecutables": [],
  "extraSignatures": [],
  "extraRegexSignatures": [],
  "signaturesFile": ".execfence/config/signatures.json",
  "baselineFile": ".execfence/config/baseline.json",
  "reportsDir": ".execfence/reports",
  "reportsGitignore": true,
  "analysis": {
    "webEnrichment": {
      "enabled": false,
      "maxQueriesPerFinding": 3,
      "allowedDomains": []
    }
  },
  "workflowHardening": true,
  "archiveAudit": true,
  "auditAllPackageScripts": false
}
